args="$*"
if [ "$args" = "-H /dev/sda" ]; then
  echo "smartctl 7.0 2018-12-30 r4883 [x86_64-linux-3.10.0-1062.el7.x86_64] (local build)
Copyright (C) 2002-18, Bruce Allen, Christian Franke, www.smartmontools.org

=== START OF READ SMART DATA SECTION ===
SMART overall-health self-assessment test result: PASSED
"
fi

if [ "$args" = "-H /dev/sdb" ]; then
  echo "smartctl 7.0 2018-12-30 r4883 [x86_64-linux-3.10.0-1062.el7.x86_64] (local build)
Copyright (C) 2002-18, Bruce Allen, Christian Franke, www.smartmontools.org

=== START OF READ SMART DATA SECTION ===
SMART overall-health self-assessment test result: PASSED

"
fi


if [ "$args" = "-A /dev/sda" ]; then
  echo "smartctl 7.0 2018-12-30 r4883 [x86_64-linux-3.10.0-1062.el7.x86_64] (local build)
Copyright (C) 2002-18, Bruce Allen, Christian Franke, www.smartmontools.org

=== START OF READ SMART DATA SECTION ===
SMART Attributes Data Structure revision number: 10
Vendor Specific SMART Attributes with Thresholds:
ID# ATTRIBUTE_NAME          FLAG     VALUE WORST THRESH TYPE      UPDATED  WHEN_FAILED RAW_VALUE
  1 Raw_Read_Error_Rate     0x000f   082   067   044    Pre-fail  Always   FAILED-MOCK 155491776
  3 Spin_Up_Time            0x0003   098   098   000    Pre-fail  Always       2       0
  4 Start_Stop_Count        0x0032   100   100   020    Old_age   Always       3       4
  5 Reallocated_Sector_Ct   0x0033   100   100   010    Pre-fail  Always       4       0
  7 Seek_Error_Rate         0x000f   086   060   045    Pre-fail  Always       5       385463477
  9 Power_On_Hours          0x0032   099   099   000    Old_age   Always       6       1442
 10 Spin_Retry_Count        0x0013   100   100   097    Pre-fail  Always       7       0
 12 Power_Cycle_Count       0x0032   100   100   020    Old_age   Always       8       4
184 End-to-End_Error        0x0032   100   100   099    Old_age   Always       -       0
187 Reported_Uncorrect      0x0032   100   100   000    Old_age   Always       -       0
188 Command_Timeout         0x0032   100   100   000    Old_age   Always       -       0 0 0
189 High_Fly_Writes         0x003a   100   100   000    Old_age   Always       -       0
190 Airflow_Temperature_Cel 0x0022   076   073   040    Old_age   Always       -       24 (Min/Max 19/27)
191 G-Sense_Error_Rate      0x0032   100   100   000    Old_age   Always       -       123
192 Power-Off_Retract_Count 0x0032   100   100   000    Old_age   Always       -       53
193 Load_Cycle_Count        0x0032   100   100   000    Old_age   Always       -       641
194 Temperature_Celsius     0x0022   024   040   000    Old_age   Always       -       24 (0 19 0 0 0)
195 Hardware_ECC_Recovered  0x001a   009   001   000    Old_age   Always       -       155491776
197 Current_Pending_Sector  0x0012   100   100   000    Old_age   Always       -       0
198 Offline_Uncorrectable   0x0010   100   100   000    Old_age   Offline      -       0
199 UDMA_CRC_Error_Count    0x003e   200   200   000    Old_age   Always       -       0
240 Head_Flying_Hours       0x0000   100   253   000    Old_age   Offline      -       1343h+40m+40.614s
241 Total_LBAs_Written      0x0000   100   253   000    Old_age   Offline      -       152512434
242 Total_LBAs_Read         0x0000   100   253   000    Old_age   Offline      -       2979342
"
fi